{"digest_is_authentication":false,"input_receipt_id":"1bde6ef982931cfe07a375da37bded38921a8e4dbc31ef5aa77424239c821753","may_authorize_effects":false,"operational_authority":"none","pack_sha256":"44fa5aced73c6a2fc1eb3cb827955d245c887fa8d7c596e353bb2e9678119169","raw_content_included":false,"schema_version":"llm-safety-policy-input-receipt-v1.0","signals":{"generated_resource_unverified":"unknown","git_change_control_unclear":"absent","handoff_verification_incomplete":"present","observation_metadata_invalid":"absent","research_authorization_unclear":"absent","secret_exposure_risk":"absent","untrusted_instructions_detected":"present"},"source_class":"synthetic_fixture","subject_digest_semantics":"caller_supplied_sanitized_subject_commitment","subject_sha256":"aaaaaaaaaaaaaaaaaaaaaaaaaaaaaaaaaaaaaaaaaaaaaaaaaaaaaaaaaaaaaaaa"}
